SchoolDistrictName,HouseholdIncome
Syracuse City School District,66537
Taconic Hills Central School District,98860
Thousand Islands Central School District,77542
Three Village Central School District,155652
Ticonderoga Central School District,91032
Tioga Central School District,72010
Tonawanda City School District,70564
Town of Webb Union Free School District,88819
Tri-Valley Central School District,79996
Troy City School District,76127
Trumansburg Central School District,74299
Tuckahoe Common School District,173071
Tuckahoe Union Free School District,156791
Tully Central School District,86379
Tupper Lake Central School District,67320
Tuxedo Union Free School District,136204
Unadilla Valley Central School District,71501
Union Free School District of the Tarrytowns,209717
Union Springs Central School District,81892
Uniondale Union Free School District,141110
Union-Endicott Central School District,73884
Utica City School District,78802
Valhalla Union Free School District,142246
Valley Central School District (Montgomery),107795
Valley Stream Central High School District,139949
Valley Stream Union Free School District 13,136859
Valley Stream Union Free School District 24,141733
Valley Stream Union Free School District 30,138416
Van Hornesville-Owen D. Young Central School District,67381
Vestal Central School District,87889
Victor Central School District,105393
Voorheesville Central School District,121379
Wainscott Common School District,163550
Wallkill Central School District,97601
Walton Central School District,68228
Wantagh Union Free School District,162595
Wappingers Central School District,117236
Warrensburg Central School District,82045
Warsaw Central School District,71994
Warwick Valley Central School District,119481
Washingtonville Central School District,117327
Waterford-Halfmoon Union Free School District,92875
Waterloo Central School District,66581
Watertown City School District,69519
Waterville Central School District,98192
Watervliet City School District,71188
Watkins Glen Central School District,75781
Waverly Central School District,65929
Wayland-Cohocton Central School District,72432
Wayne Central School District,96292
Webster Central School District,91107
Weedsport Central School District,77605
Wells Central School District,68150
Wellsville Central School District,64833
West Babylon Union Free School District,125550
West Canada Valley Central School District,73411
West Genesee Central School District,88718
West Hempstead Union Free School District,133369
West Irondequoit Central School District,68921
West Islip Union Free School District,137778
West Seneca Central School District,72088
West Valley Central School District,69972
Westbury Union Free School District,213566
Westfield Central School District,70468
Westhampton Beach Union Free School District,152661
Westhill Central School District,81323
Westmoreland Central School District,77682
Wheatland-Chili Central School District,78865
Wheelerville Union Free School District,64492
White Plains City School District,144877
Whitehall Central School District,77265
Whitesboro Central School District,78105
Whitesville Central School District,65131
Whitney Point Central School District,69638
William Floyd Union Free School District,109015
Williamson Central School District,86584
Williamsville Central School District,115536
Willsboro Central School District,76735
Wilson Central School District,83496
Windham-Ashland-Jewett Central School District,72711
Windsor Central School District,65186
Worcester Central School District,67765
Wyandanch Union Free School District,112423
Wynantskill Union Free School District,87213
Wyoming Central School District,71202
Yonkers City School District,134752
York Central School District,75333
Yorkshire-Pioneer Central School District,73122
Yorktown Central School District,176925
